{
  "schemaVersion": "1.0.0",
  "productVersion": "1.0.1",
  "identity": {
    "id": "net-worth-tracker",
    "slug": "net-worth-tracker",
    "productId": "numberninja-net-worth-tracker-v1",
    "sku": "NND-DIG-FIN-003",
    "route": "net-worth-tracker.html"
  },
  "organization": {
    "brand": "NumberNinjaDesigns",
    "branch": "Digital Production",
    "governance": "Studio OS"
  },
  "catalog": {
    "name": "Net Worth Tracker",
    "status": "coming-soon",
    "statusLabel": "Coming soon",
    "type": "Excel workbook",
    "shortDescription": "An offline Excel net-worth tracker for assets, liabilities, monthly history, and long-term progress.",
    "targetAudience": "individuals tracking assets, liabilities, and net worth over time",
    "availability": "preview-only",
    "cta": {
      "label": "View product preview"
    }
  },
  "workbook": {
    "features": [
      "Asset value overview",
      "Liability balance overview",
      "Monthly net-worth history",
      "Net-worth trend dashboard",
      "Built-in integrity checks",
      "Privacy-safe offline workflow"
    ],
    "sheets": [
      "Start",
      "Assets",
      "Liabilities",
      "History",
      "Dashboard",
      "Checks"
    ],
    "formulaFamilies": [
      "SUM",
      "SUMIFS",
      "COUNTIF",
      "IF"
    ],
    "compatibility": [
      "Microsoft Excel 2021 or later on Windows"
    ],
    "dashboards": [
      "NumberNinja Net Worth Tracker Dashboard"
    ],
    "charts": [
      "Product-specific progress chart"
    ]
  },
  "delivery": {
    "fileFormats": [
      "ZIP",
      "XLSX",
      "PDF"
    ],
    "includedFiles": [
      "NumberNinja-Net-Worth-Tracker-v1.0.1.xlsx",
      "NumberNinja-Net-Worth-Tracker-Guide-v1.0.1.pdf"
    ],
    "deliveryFiles": [
      "NumberNinja-Net-Worth-Tracker-v1.0.1.zip"
    ]
  },
  "seo": {
    "primaryKeyword": "net worth tracker",
    "title": "Net Worth Tracker Spreadsheet | Assets, Liabilities and Monthly Progress | Digital Download",
    "tags": [
      "net worth tracker",
      "net worth excel",
      "asset tracker",
      "liability tracker",
      "wealth tracker",
      "finance dashboard",
      "monthly net worth",
      "personal finance",
      "excel template",
      "money tracker",
      "digital download",
      "asset liability",
      "financial organizer"
    ]
  },
  "instructions": [
    "Download the ZIP from Etsy Purchases",
    "Extract the ZIP on a computer",
    "Open the XLSX file in Microsoft Excel 2021 or later on Windows",
    "Replace blue example cells with personal data",
    "Review the Dashboard and Checks sheets"
  ],
  "pricing": {
    "strategy": "FIXED_LAUNCH",
    "amount": 8.95,
    "currency": "EUR",
    "discountFloor": 6.75,
    "basis": "owner-hypothesis",
    "marketDataUsed": false,
    "rationale": "Seller-defined introductory launch price; not derived from marketplace sales, demand, conversion, or revenue evidence."
  },
  "disclosures": {
    "ai": "Created with assistance from AI tools, then reviewed, customized, and quality-tested by NumberNinjaDesigns.",
    "legal": "Organizational and educational tool only; not financial, tax, legal, credit, debt-management, or investment advice."
  },
  "launchState": {
    "stage": "quality-approved",
    "approval": "owner-approved",
    "publicationReady": false
  },
  "provider": {
    "enabled": false,
    "adapter": null,
    "externalListingId": null,
    "syncState": "not-configured"
  },
  "provenance": {
    "sourceManifest": "outputs/finance-product-factory/net-worth-tracker/product-manifest.json",
    "sourceProductId": "numberninja-net-worth-v1",
    "sourceProductName": "NumberNinja Net Worth Tracker",
    "blueprintId": "finance-networth-v1",
    "language": "English",
    "locale": "en-US",
    "theme": "Dark tactical",
    "generatedAt": "2026-07-12T12:00:00.000Z"
  }
}
