{
  "schemaVersion": "1.0.0",
  "productVersion": "1.0.1",
  "identity": {
    "id": "debt-payoff-tracker",
    "slug": "debt-payoff-tracker",
    "productId": "numberninja-debt-payoff-tracker-v1",
    "sku": "NND-DIG-FIN-002",
    "route": "debt-payoff-tracker.html"
  },
  "organization": {
    "brand": "NumberNinjaDesigns",
    "branch": "Digital Production",
    "governance": "Studio OS"
  },
  "catalog": {
    "name": "Debt Payoff Tracker",
    "status": "coming-soon",
    "statusLabel": "Coming soon",
    "type": "Excel workbook",
    "shortDescription": "An offline Excel debt tracker for balances, APR, planned payments, payment history, and payoff progress.",
    "targetAudience": "people organizing debt balances and planned payments",
    "availability": "preview-only",
    "cta": {
      "label": "View product preview"
    }
  },
  "workbook": {
    "features": [
      "Balance and APR overview",
      "Minimum plus extra payment planning",
      "Principal and interest payment log",
      "Payoff progress dashboard",
      "Payment sustainability checks",
      "Privacy-safe offline workflow"
    ],
    "sheets": [
      "Start",
      "Debts",
      "Payment Log",
      "Dashboard",
      "Checks"
    ],
    "formulaFamilies": [
      "SUM",
      "SUMIFS",
      "COUNTIF",
      "IF"
    ],
    "compatibility": [
      "Microsoft Excel 2021 or later on Windows"
    ],
    "dashboards": [
      "NumberNinja Debt Payoff Tracker Dashboard"
    ],
    "charts": [
      "Product-specific progress chart"
    ]
  },
  "delivery": {
    "fileFormats": [
      "ZIP",
      "XLSX",
      "PDF"
    ],
    "includedFiles": [
      "NumberNinja-Debt-Payoff-Tracker-v1.0.1.xlsx",
      "NumberNinja-Debt-Payoff-Tracker-Guide-v1.0.1.pdf"
    ],
    "deliveryFiles": [
      "NumberNinja-Debt-Payoff-Tracker-v1.0.1.zip"
    ]
  },
  "seo": {
    "primaryKeyword": "debt payoff tracker",
    "title": "Debt Payoff Tracker Spreadsheet | Balances, APR and Payment Progress | Digital Download",
    "tags": [
      "debt payoff tracker",
      "debt spreadsheet",
      "debt payment plan",
      "loan tracker",
      "credit card tracker",
      "debt balance tracker",
      "payoff progress",
      "apr tracker",
      "payment log",
      "excel debt planner",
      "debt organizer",
      "digital download",
      "personal finance"
    ]
  },
  "instructions": [
    "Download the ZIP from Etsy Purchases",
    "Extract the ZIP on a computer",
    "Open the XLSX file in Microsoft Excel 2021 or later on Windows",
    "Replace blue example cells with personal data",
    "Review the Dashboard and Checks sheets"
  ],
  "pricing": {
    "strategy": "FIXED_LAUNCH",
    "amount": 9.95,
    "currency": "EUR",
    "discountFloor": 7.45,
    "basis": "owner-hypothesis",
    "marketDataUsed": false,
    "rationale": "Seller-defined introductory launch price; not derived from marketplace sales, demand, conversion, or revenue evidence."
  },
  "disclosures": {
    "ai": "Created with assistance from AI tools, then reviewed, customized, and quality-tested by NumberNinjaDesigns.",
    "legal": "Organizational and educational tool only; not financial, tax, legal, credit, debt-management, or investment advice."
  },
  "launchState": {
    "stage": "quality-approved",
    "approval": "owner-approved",
    "publicationReady": false
  },
  "provider": {
    "enabled": false,
    "adapter": null,
    "externalListingId": null,
    "syncState": "not-configured"
  },
  "provenance": {
    "sourceManifest": "outputs/finance-product-factory/debt-payoff-tracker/product-manifest.json",
    "sourceProductId": "numberninja-debt-payoff-v1",
    "sourceProductName": "NumberNinja Debt Payoff Tracker",
    "blueprintId": "finance-debt-v1",
    "language": "English",
    "locale": "en-US",
    "theme": "Dark tactical",
    "generatedAt": "2026-07-12T12:00:00.000Z"
  }
}
